{
  "schema_version": "1.0.0",
  "dataset_version": "2026-08-29.1",
  "reviewed_at": "2026-08-29",
  "purpose": "Short original explanations for terms exposed by the collection companion. Stable definitions point to canonical collection or pinned knowledge resources; changeable game mechanics point to the reviewed mechanics registry.",
  "entries": [
    {"id":"iv-percent","term":"IV %","aliases":["IV average","IV percentage"],"definition":"A percentage summary of the three appraisal IVs. Exact Attack, Defense, and HP IVs carry the underlying values.","why_it_matters":"Two Pokémon can share the same IV percentage while distributing those IVs differently, which can change league eligibility or matchup behavior.","classification":"collection-derived","source_resource":"data/schema.json"},
    {"id":"exact-ivs","term":"Exact IVs","aliases":["A/D/HP","Attack Defense HP IVs"],"definition":"The individual Attack, Defense, and HP appraisal values, each recorded from 0 through 15 when the source export provides them.","why_it_matters":"Exact values support hundo/nundo detection, CP calculations, and PvP IV comparisons that a single percentage cannot express.","classification":"collection-fact","source_resource":"data/schema.json"},
    {"id":"appraisal-stars","term":"Appraisal stars","aliases":["stars","3 star","4 star"],"definition":"Pokémon GO appraisal bands derived from the appraisal IV total. They summarize ordinary IV quality and do not encode PvP rank.","why_it_matters":"A lower-star Pokémon can have a stronger league-capped PvP IV spread than a higher-star copy.","classification":"stable-mechanic","source_resource":"data/mechanics/index.json"},
    {"id":"hundo","term":"Hundo","aliases":["100 IV","15/15/15"],"definition":"A Pokémon whose Attack, Defense, and HP IVs are all 15.","why_it_matters":"It is the maximum ordinary IV combination, while specific league-capped PvP formats can prefer different distributions.","classification":"collection-derived","source_resource":"data/schema.json"},
    {"id":"nundo","term":"Nundo","aliases":["0/0/0","zero IV"],"definition":"A Pokémon whose Attack, Defense, and HP IVs are all 0.","why_it_matters":"It is a rare collector pattern and should remain distinguishable from ordinary low-IV transfer candidates.","classification":"collection-derived","source_resource":"data/schema.json"},
    {"id":"pvp-rank","term":"PvP rank","aliases":["league rank","Poke Genie rank"],"definition":"A ranking of an IV combination under a specified league CP cap and evolution target. The repository treats Poke Genie rank as an IV-ranking input rather than a current-meta ranking.","why_it_matters":"Rank 1 describes one IV optimization target; matchups, moves, team role, cup rules, and current meta can change which owned copy performs best.","classification":"source-derived","source_resource":"data/schema.json"},
    {"id":"stat-product","term":"Stat product","aliases":["PvP stat product"],"definition":"A combined measure of battle Attack, Defense, and HP commonly used to compare league-capped IV combinations.","why_it_matters":"It summarizes overall stat volume and does not by itself predict every matchup or breakpoint.","classification":"calculated-model","source_resource":"data/pvp-battle-lab.json"},
    {"id":"cp-cap","term":"CP cap","aliases":["league cap"],"definition":"The maximum CP allowed by a league or cup format when that format defines one.","why_it_matters":"Powering past a cap can make a Pokémon ineligible for that format.","classification":"stable-mechanic","source_resource":"data/mechanics/index.json"},
    {"id":"cmp","term":"CMP","aliases":["Charge Move Priority"],"definition":"The tie-resolution concept used when opposing Charged Attacks are launched together. The battle model must use comparable battle Attack rather than Attack IV alone.","why_it_matters":"A higher Attack IV does not automatically prove CMP advantage because level, base stats, and other modifiers contribute to battle Attack.","classification":"battle-model","source_resource":"data/pvp-battle-lab.json"},
    {"id":"breakpoint","term":"Breakpoint","aliases":["attack breakpoint"],"definition":"A threshold where a stat change alters discrete damage in a modeled matchup.","why_it_matters":"A small Attack difference can matter when it crosses a specific matchup threshold even if another copy has higher overall stat product.","classification":"battle-model","source_resource":"data/pvp-battle-lab.json"},
    {"id":"bulkpoint","term":"Bulkpoint","aliases":["defense bulkpoint"],"definition":"A threshold where additional defensive bulk changes discrete incoming damage in a modeled matchup.","why_it_matters":"Bulkpoints are matchup-specific and require an explicit battle model and opponent assumptions.","classification":"battle-model","source_resource":"data/pvp-battle-lab.json"},
    {"id":"dps","term":"DPS","aliases":["damage per second"],"definition":"Damage dealt per unit of time under a stated battle model.","why_it_matters":"Higher DPS can shorten battles, while survivability and total damage can still change the best team choice.","classification":"battle-model","source_resource":"data/pvp-battle-lab.json"},
    {"id":"tdo","term":"TDO","aliases":["total damage output"],"definition":"Total modeled damage a Pokémon deals before fainting or otherwise leaving the modeled battle.","why_it_matters":"TDO emphasizes sustained contribution and can favor bulkier options than a DPS-only ranking.","classification":"battle-model","source_resource":"data/pvp-battle-lab.json"},
    {"id":"ttw","term":"TTW","aliases":["time to win"],"definition":"Modeled time required for the selected attackers and assumptions to defeat a target.","why_it_matters":"TTW depends on the chosen boss, moves, weather or friendship assumptions, team composition, and model version.","classification":"battle-model","source_resource":"data/pvp-battle-lab.json"},
    {"id":"survivability","term":"Survivability","aliases":["bulk","staying power"],"definition":"How long an attacker or defender remains effective under a stated battle model.","why_it_matters":"A Pokémon with lower peak damage can contribute more total value when it stays active longer.","classification":"battle-model","source_resource":"data/pvp-battle-lab.json"},
    {"id":"shadow-bonus","term":"Shadow bonus","aliases":["Shadow damage bonus"],"definition":"Battle modifiers associated with Shadow Pokémon. The exact supported rules come from the reviewed mechanics registry.","why_it_matters":"Shadow status changes battle tradeoffs and can make purification an irreversible decision that deserves separate review.","classification":"current-mechanic","source_resource":"data/mechanics/index.json"},
    {"id":"purification","term":"Purification","aliases":["purify"],"definition":"The in-game action that changes a Shadow Pokémon into a Purified Pokémon under the current reviewed mechanics.","why_it_matters":"The action is irreversible, changes relevant stats or moves under current rules, and should be reviewed before use.","classification":"current-mechanic","source_resource":"data/mechanics/index.json"},
    {"id":"frustration","term":"Frustration","aliases":[],"definition":"A Shadow-associated Charged Attack whose removal rules can depend on current Pokémon GO mechanics or events.","why_it_matters":"Move availability can block an otherwise attractive build, so current removal rules must be checked before spending resources.","classification":"current-mechanic","source_resource":"data/mechanics/index.json"},
    {"id":"return","term":"Return","aliases":[],"definition":"A Charged Attack associated with Purified Pokémon under the reviewed mechanics.","why_it_matters":"Purification can alter move options, so a build comparison should account for the resulting moveset rather than IV changes alone.","classification":"current-mechanic","source_resource":"data/mechanics/index.json"},
    {"id":"fast-move","term":"Fast Move","aliases":["Fast Attack","Quick Move"],"definition":"The repeatedly used attack that generates energy in battle systems where the model supports that mechanic.","why_it_matters":"Fast Move damage, energy generation, typing, and timing shape how quickly Charged Moves become available.","classification":"stable-knowledge","source_resource":"data/knowledge/pokemon-go.json"},
    {"id":"charged-move","term":"Charged Move","aliases":["Charged Attack"],"definition":"An attack that consumes accumulated battle energy where the applicable battle system uses that mechanic.","why_it_matters":"Move choice changes coverage, shield pressure, damage windows, and whether an owned Pokémon needs a TM or second move.","classification":"stable-knowledge","source_resource":"data/knowledge/pokemon-go.json"},
    {"id":"legacy-exclusive-move","term":"Legacy or exclusive move","aliases":["legacy move","exclusive move"],"definition":"A move whose ordinary availability is restricted relative to the current standard move pool.","why_it_matters":"A recommended build can be blocked or require an Elite TM when the needed move is unavailable through ordinary TMs.","classification":"stable-knowledge","source_resource":"data/knowledge/pokemon-go.json"},
    {"id":"elite-tm","term":"Elite TM","aliases":["Elite Fast TM","Elite Charged TM"],"definition":"A scarce item used to select moves from a broader eligible pool under current Pokémon GO rules.","why_it_matters":"Its scarcity creates an opportunity cost, so plans should compare owned alternatives before recommending its use.","classification":"current-mechanic","source_resource":"data/mechanics/index.json"},